iteration,task_score,semantic_score,selection_score,hack_score,failure_modes,dominant_component,dominant_component_ratio,benign_terminal_dominance,terminal_goal_evidence,reward_repetition_risk,success_episode_rate,terminal_reward_paid_episode_rate,stable_landing_episode_rate,safe_contact_episode_rate,contact_toggle_mean,contact_toggle_max,posthoc_return_mean,posthoc_return_std,posthoc_episode_length_mean,edit_generated,edit_decision,edit_status,edit_valid,edit_errors,edit_count,edit_diagnosis,memory_failure_modes,memory_outcome_status,outcome_task_delta,outcome_semantic_delta,outcome_selection_delta,outcome_hack_delta,component_ratio__r_approach_region,component_trigger__r_approach_region,component_ratio__r_approach_progress,component_trigger__r_approach_progress,component_ratio__r_stability,component_trigger__r_stability,component_ratio__r_landing_quality,component_trigger__r_landing_quality,component_ratio__r_energy,component_trigger__r_energy,component_ratio__r_safe_contact_once,component_trigger__r_safe_contact_once,component_ratio__r_stable_landing_once,component_trigger__r_stable_landing_once,component_ratio__r_approach_stagnation_penalty,component_trigger__r_approach_stagnation_penalty
0,0.6750753195642296,0.6750753195642295,0.9501506391284592,0.4,repeated_event_exploitation;shaping_goal_mismatch,r_approach_region,0.40329847660111234,False,False,False,0.0,0.0,0.0,0.0,13.8,31.0,-15.24434856693397,25.19560635856046,1000.0,True,edit,valid,True,,4,"Dense shaping components r_approach_region, r_stability, and r_landing_quality are too generous, allowing the agent to exploit repeated contact toggling and collect high reward without ever completing a stable landing. This is a reward hack, not a false positive. The fix requires simultaneously reducing those shaping weights and increasing the one‑time stable‑landing bonus to shift the policy gradient toward successful, fast landings.",repeated_event_exploitation;shaping_goal_mismatch,pending,,,,,0.40329847660111234,1.0,0.00042985502225694253,0.2516,0.21936127307628586,1.0,0.3709462751108647,1.0,0.005964120190437361,0.9949,0.0,0.0,0.0,0.0,,
1,1.1420224224153126,1.4920224224153127,2.6340448448306253,0.0,,r_landing_quality,0.4353557483877186,False,True,False,0.3,0.2,0.3,0.4,64.9,217.0,141.10480606111088,83.70334551617992,713.0,True,edit,valid,True,,5,"The reward schema still over-emphasizes dense shaping, resulting in only 30% landing success and persistent unstable contacts. Further coupled rebalancing—decreasing dense weights and significantly boosting the one‑time stable‑landing bonus, with an optional progress boost—is the safe, proven path to shift the policy toward reliable landings.",,pending,,,,,0.23267449290830453,1.0,0.0016864246905357806,0.259726321438154,0.2827158162495795,1.0,0.4353557483877186,1.0,0.015816640640781105,0.9022001609873893,0.0035278752358619565,0.0004024684733029246,0.02822300188689565,0.00026831231553528306,,
2,2.075567051727422,3.1255670517274217,5.2011341034548435,0.0,,r_stable_landing_once,0.5257411381421051,False,True,False,0.7,0.7,0.7,1.0,24.2,62.0,156.33470811568424,78.40013677670976,517.1,True,edit,valid,True,,4,Agent lands with 70% success but dense shaping encourages prolonged bouncing; further coupled rebalancing of dense weights (halving r_stability and r_landing_quality) and terminal bonus (20% boost) with progress‑based shaping increase (50% boost on r_approach_progress) should improve speed and task performance while retaining adequate guidance.,,pending,,,,,0.07623163974877134,1.0,0.004487694898727188,0.20988478877942895,0.12819976276858758,1.0,0.23098195518193768,1.0,0.01871075157709313,0.998330272165637,0.01564705768280075,0.0016697278343629988,0.5257411381421051,0.0011688094840540991,,
3,2.7076205656670416,4.2076205656670425,6.915241131334084,0.0,,r_stable_landing_once,0.6600082389570967,False,True,False,1.0,1.0,1.0,1.0,146.0,202.0,87.13823968553314,92.44461926293948,872.4,True,no_edit,valid,True,,1,"Agent achieves perfect landings but takes ~940 steps per episode because per‑step dense rewards create a marginal gain for lingering. The lack of any time penalty or speed incentive is the root cause. No reward hack; only task failure. Memory warns that further dense weight reduction without a speed lever will worsen control. Since the required step‑penalty operator is not available, a structural search for a time‑aware component is indicated.",,pending,,,,,0.08982928628063812,1.0,0.0049295943703024005,0.15835995740149095,0.0749373647112627,1.0,0.13814532267957141,1.0,0.020691716630359812,0.9615548455804047,0.011458476370782929,0.0010649627263045794,0.6600082389570967,0.0010649627263045794,,
4,0.13687751145427318,0.13687751145427318,-0.3262449770914536,0.6,single_component_dominance;repeated_event_exploitation;shaping_goal_mismatch,r_approach_stagnation_penalty,0.7748701786640202,False,False,False,0.0,0.0,0.0,0.1,137.5,414.0,-12.494042617737588,81.81203534263238,339.0,True,edit,invalid_or_fallback,False,target not found: r_approach_stagnation_penalty;No valid edit remained; skipped schema edit.,0,"The r_approach_stagnation_penalty added in the previous iteration dominates the reward signal (ratio 0.775), preventing any landing and creating a false impression of reward hack. Its removal restores the proven schema that previously achieved 100% stable landing success.",single_component_dominance;repeated_event_exploitation;shaping_goal_mismatch,not_applicable,,,,,0.07767223158903952,1.0,0.015496035505295505,0.6147284617571794,0.05976548893176816,1.0,0.05026012691872817,1.0,0.018192604194720473,0.6909297696900768,0.003743334196444542,0.0002843332385555871,0.0,0.0,0.7748701786640202,0.5885698038100654
5,2.7076205656670416,4.2076205656670425,6.915241131334084,0.0,,r_stable_landing_once,0.6600082389570967,False,True,False,1.0,1.0,1.0,1.0,146.0,202.0,87.13823968553314,92.44461926293948,872.4,True,no_edit,no_edit,no_edit,LLM chose no_edit with next_action=early_stop; no schema edit applied.,0,Task failure: agent achieves perfect landings but takes ~940 steps because no time penalty or speed incentive exists. Dense absolute approach_region reward encourages hovering. Reflection and memory recommend a structural search for a mild time penalty or progress‑only reshape. No allowed operator can directly add a step penalty; thus structural_search is the correct action.,,not_applicable,,,,,0.08982928628063812,1.0,0.0049295943703024005,0.15835995740149095,0.0749373647112627,1.0,0.13814532267957141,1.0,0.020691716630359812,0.9615548455804047,0.011458476370782929,0.0010649627263045794,0.6600082389570967,0.0010649627263045794,,
